<?xml version="1.0" encoding="utf-8"?><!--*- coding: utf-8 -*-->
<!DOCTYPE resources SYSTEM "../../components/xmlbundle/resources.dtd">
<resources default="en">
	<entry key="export_file_text">
		<text lang="en">Export view to iCal file</text>
		<text lang="de">Exportiere Sicht in iCal File</text>
		<text lang="fr">Exporte la vue en iCal File</text>
	</entry>
	<entry key="export_ical_text">
		<text lang="en">Publish calendar to iCal</text>
		<text lang="de">Veröffentliche Kalender nach iCal</text>
		<text lang="fr">Publier le calendrier en iCal</text>
    <text lang="es">Publicar el calendario en iCal</text>
	</entry>
	<entry key="previous_days_text">
		<text lang="en">previous days:</text>
		<text lang="de">vorhergehende Tage:</text>
		<text lang="fr">les jours précédents:</text>
	</entry>
	<entry key="subsequent_days_text">
		<text lang="en">subsequent days:</text>
		<text lang="de">darauffolgende Tage:</text>
		<text lang="fr">les jours suivants:</text>
	</entry>
	<entry key="user_interval_setting_text">
		<text lang="en">User interval setting:</text>
		<text lang="de">Benutzerspezifische Intervalleinstellung:</text>
		<text lang="fr">le paramètre d`intervalle utilisateur spécifique:</text>
	</entry>
	<entry key="created_succesfully_text">
		<text lang="en">Successfully created.</text>
		<text lang="de">Erfolgreich angelegt.</text>
		<text lang="fr">Créé avec succès.</text>
	</entry>
	<entry key="no_dates_text">
		<text lang="en">No dates available in the current view.</text>
		<text lang="de">In der aktuellen Ansicht sind keine Termine vorhanden.</text>
		<text lang="fr">Pas de dates disponibles dans la vue en cours.</text>
	</entry>
	<entry key="export_file_succesfull_text">
		<text lang="en">The iCal file has been successfully created.</text>
		<text lang="de">Die iCal Datei wurde erfolgreich erstellt.</text>
		<text lang="fr">Le fichier iCal a été créé avec succès.</text>
	</entry>
	<entry key="use_user_interval_setting_text">
		<text lang="en">use user interval setting</text>
		<text lang="de">benutzerspezifische Intervalleinstellung verwenden</text>
		<text lang="fr">utiliser le paramètre d`intervalle utilisateur spécifique:</text>
	</entry>
    <entry key="ical_export_user_settings">
        <text lang="en">ICal Export Settings</text>
        <text lang="de">ICal Export Einstellungen</text>
        <text lang="fr">ICal Export Settings</text>
    </entry>

    <entry key="participation_status">
        <text lang="en">Participation Status</text>
        <text lang="de">Teilnahme Status in Einladungen</text>
        <text lang="fr">Participation Status</text>

    </entry>

    <entry key="export_attendees_of_vevent">
        <text lang="en">Export Person Resource as Attendees</text>
        <text lang="de">Teilnehmer einer Veranstaltung exportieren</text>
        <text lang="fr">Export Person Resource as Attendees</text>
    </entry>

</resources>