<?xml version="1.0" encoding="utf-8"?><!--*- coding: utf-8 -*-->
<!DOCTYPE resources SYSTEM "../../components/xmlbundle/resources.dtd">
<resources default="en">
    <entry key="url">
    	<text lang="en">URL</text>
    	<text lang="de">URL</text>
	</entry>
	<entry key="enter_url">
    	<text lang="en">Enter URL</text>
    	<text lang="de">URL eingeben</text>
	</entry>
	<entry key="click_for_file">
    	<text lang="en">click here to select local file</text>
    	<text lang="de">Klicken Sie hier, um eine lokale Datei auszuw√§hlen</text>
	</entry>
    <entry key="ical.import">
        <text lang="en">Import iCal Calendar</text>
        <text lang="de">Importiere iCal Kalender</text>
    </entry>


</resources>